reviewId,comment,score,date,cleaned_text,english,bugs,content,feature,ui,navigation,billing,brand,price_billing_payment,login,device,customer support,other
53cc8a80-a800-4c84-bb25-d124023c1a62,"I think Netflix is really great! I don't have cable so I watch all of my TV shows and movies on Netflix! The only downside I have to Netflix are they release a lot more of their own stuff now(which its actually starting to get good), and not focusing on bringing stuff onto Netflix that people have been requesting.",4,09-11-2018 20:57,think netflix really great dont cable watch tv show movie netflix downside netflix release lot stuff nowwhich actually starting get good focusing bringing stuff onto netflix people requesting,TRUE,,,,,,,,,,,,
954bdc0b-5c86-4bb8-bb6b-c0a1f2e187f8,"Terrible app, on a number of occasions I've downloaded shows to watch and then gone to my download sections and they no longer appear but yet the downloads are in my phone memory. Or even if they still appear you get part way through and it then says there's an error with the file. Completely unreliable",1,06-12-2018 09:35,terrible app number occasion ive downloaded show watch gone download section longer appear yet downloads phone memoryr even still appear get part way say there error file completely unreliable,TRUE,,,,,,,,,,,,
d898c7b8-8a6f-4d39-9fa3-6336f1f46975,Great selection and easy to use!,5,12-12-2018 19:50,great selection easy use,TRUE,,,,,,,,,,,,
c4b58e86-8654-4d6c-a165-f78b941c333f,"I'd wish they'd add more episodes to seasons, at least the netflix originals. Other than that it's awesome",5,06-12-2018 00:13,id wish theyd add episode season least netflix originalsther awesome,TRUE,,,,,,,,,,,,
58c0a1f4-94c2-4b91-bf3c-350a405831ce,I think in my words netflix is on of the apps that you could watch a series a show maybe a movie but I think this is app is the only app I ever want to watch any of those things,5,16-11-2018 04:11,think word netflix apps could watch series show maybe movie think app app ever want watch thing,TRUE,,,,,,,,,,,,
4302ca89-e6dc-4256-adf5-a2aaf630d78a,Love watching the movies I always want to but they should bring back more Disney movies,5,27-09-2018 19:22,love watching movie always want bring back moreisney movie,TRUE,,,,,,,,,,,,
d2fe468f-534e-45c9-8cf3-cd2cbf5b65ab,App doesn't work after the last update...,1,16-12-2018 20:26,app doesnt work last update,TRUE,,,,,,,,,,,,
327cb81e-f6ac-40bf-9fde-f24e3afa03d5,"very easy to find the movies I love, very convenient.",5,26-12-2018 03:51,easy find movie love convenient,TRUE,,,,,,,,,,,,
a9a6f407-9abf-44f8-8d9a-9353065b7583,"I would rate more stars but this app has some issues. It likes to log me out while viewing, or log me out when I am trying to rewind or start an episode over. It is quite annoying to deal with. I have uninstalled and reinstalled the app many times and I am still having this recurring issue. I use this app on a Galaxy 8 so there should be no problems like this.",3,08-10-2018 00:39,would rate star app issue like log viewing log trying rewind start episode quite annoying deal uninstalled reinstalled app many time still recurring issue use app galaxy problem like,TRUE,,,,,,,,,,,,
62f39735-1683-458e-a0b0-72fbb8973724,The best companion on long trips. Fantastic collection of movies and TV series.,5,08-11-2018 11:13,best companion long trip fantastic collection movie tv series,TRUE,,,,,,,,,,,,
47761f14-43cd-4093-9e19-f490239dc0f6,My kids love it!!When they're watching Netflix together is the only time they get along!,5,03-11-2018 18:39,kid love itwhen theyre watching netflix together time get along,TRUE,,,,,,,,,,,,
18c382d9-a351-46ea-935c-cbd495fe92e2,"Keeps logging me out, cant do anything without having to log back in several times. Very annoying.",2,31-10-2018 13:47,keep logging cant anything without log back several time annoying,TRUE,,,,,,,,,,,,
26d76e09-a8f9-4d56-a3b1-690efa7be4e8,You are the best at this kind of movies whoever created this you are the master at it the thing I want is could you make another Netflix so I could decide to see what's better please......☺☺☺☺☺☺☺😊😊😊😊😊😊😊😊😊😊you are a master at this you are good at this you should go to the championship you are the one the lorax is my favourite you should be in there. You are are a champion at the movies you are a beast at it bro you good thanks for listening to this,5,21-11-2018 05:06,best kind movie whoever created master thing want could make another netflix could decide see whats better pleaseyou master good go championship one lorax favourite champion movie beast bro good thanks listening,TRUE,,,,,,,,,,,,
8118f62b-97ed-4044-b21a-f492db2f024f,Since recent update massively drains battery. While using Chromecast Netflix used 16.5% of my battery in less than an hour. Wouldn't have used that much just washing Netflix on my phone itself for an hour.,1,04-11-2018 00:17,since recent update massively drain battery using chromecast netflix used battery le hour wouldnt used much washing netflix phone hour,TRUE,,,,,,,,,,,,
62545e39-13e1-41f6-a0e0-2b465ece608e,"Poor app portability, too much 'compatibility' issues. Still like it though...",3,04-12-2018 08:52,poor app portability much compatibility issue still like though,TRUE,,,,,,,,,,,,
d8b87987-05b3-4477-a956-30efa9877914,Netflix is a great app but I had to give it 3 stars beacuse it took so long to load and it went fuzzy and blurry when I tried to watch anything. I had to stop mid way through an episode to restart my phone and re enter Netflix. This might just be me but this was a bug turn off for me. Other than this it offers great shows and movies totally recommended this app :),3,13-12-2018 07:58,netflix great app give star beacuse took long load went fuzzy blurry tried watch anything stop mid way episode restart phone enter netflix might bug turn mether offer great show movie totally recommended app,TRUE,,,,,,,,,,,,
d9dc54a0-0f8b-4bfd-8ea4-537f8dfe869b,This app literally stopped working on my phone after about 2 days of using it. . I had to reinstall it and that's mad annoying,1,08-10-2018 23:37,app literally stopped working phone day using reinstall thats mad annoying,TRUE,,,,,,,,,,,,
00e392b6-ba51-4f82-9c5a-c97752c9a057,"Netflix is basically the only major tv streaming service that didn't totally mess up its app, so it gets 5 stars just for that",5,29-10-2018 22:37,netflix basically major tv streaming service didnt totally mess app get star,TRUE,,,,,,,,,,,,
a7c7d390-e51c-4d95-a00e-79a5cce810cc,"5 stars if they fix the terrible battery drain. Even if I force stop, it turns itself back on and destroys my battery life.  Update, I've spent hours on this.  I finally had to disable the app.  I'll enable it when I need to use it.  However, that is absurd.  Why not fix it.  Many, many people with this problem trying to find a fix on the Internet.",3,15-10-2018 00:44,star fix terrible battery drain even force stop turn back destroys battery life update ive spent hour finally disable app ill enable need use however absurd fix many many people problem trying find fix internet,TRUE,,,,,,,,,,,,
ecff0734-1b52-4727-8d4d-87d76b25e071,Forcecloses every time can't even log in!,1,31-10-2018 01:52,forcecloses every time cant even log,TRUE,,,,,,,,,,,,
d285ec0c-3c2a-4d50-896a-38ce3f566912,Its a great app to watch shows movies they have all great movies and the latest and even the oldies so if you want to go back a rewatch your Favrite movie or show you can,5,30-10-2018 04:20,great app watch show movie great movie latest even oldie want go back rewatch favrite movie show,TRUE,,,,,,,,,,,,
0b64784c-5d9e-447e-a407-6bf6f742b857,It says on the internet that I can see a certain movie on Netflix but when I subscribed it is not available to watch they lied,3,21-11-2018 04:17,say internet see certain movie netflix subscribed available watch lied,TRUE,,,,,,,,,,,,
655e5714-a9fc-40bc-9a53-97240ff1be01,"the app is great, the only thing missing here is full screen support when using samsung dex. I use my phone a lot in Dex mode so this would a huge plus for me. hope you guys consider this an option.",4,05-11-2018 23:12,app great thing missing full screen support using samsung dex use phone lot inex mode would huge plus hope guy consider option,TRUE,,,,,,,,,,,,
6b11a6c8-698f-45e2-841a-1fbe54ba87b1,If you can be putting new episodes each time it plays on tv but the day after then you'd have a five star oh and Jimmy neutron and Henry danger,4,23-11-2018 11:08,putting new episode time play tv day youd five star oh jimmy neutron henry danger,TRUE,,,,,,,,,,,,
1a19489f-7238-431a-8918-4eef4f00bb2a,It's good but I wish it had more better horror movies and TV shows on it. I wish the Simpsons were on netflix,3,17-11-2018 18:28,good wish better horror movie tv show wish simpson netflix,TRUE,,,,,,,,,,,,
430f43a1-893a-445a-bc2b-4ed743857f92,Its great except when the show your watching stops,5,01-12-2018 03:12,great except show watching stop,TRUE,,,,,,,,,,,,
987b0953-0a44-4a34-8ea1-adc519d5b2d3,Draining battery on my Nexus 7 uses about 10% even when I don't open the app,1,03-10-2018 13:24,draining battery nexus us even dont open app,TRUE,,,,,,,,,,,,
55c2f5a5-f006-48eb-b953-de7676514a12,Would randomly give errors when trying to skip +10 seconds and then refuse to play,2,26-11-2018 05:18,would randomly give error trying skip second refuse play,TRUE,,,,,,,,,,,,
bbe43100-2b67-4b9c-9f9a-3b304c5bba3f,I like this app but sometimes it randomly logs me out and I have to re sign in but it won't let me even when I know the email and password is correct. There needs to be a better variety of shows and movies on it.,4,14-11-2018 00:40,like app sometimes randomly log sign wont let even know email password correct need better variety show movie,TRUE,,,,,,,,,,,,
db15c098-0b37-4445-9c2c-b2ebb95902bf,It's great but when I try to sign in and put the right stuff in it says I'm wrong it would be great if that got fixed,4,20-11-2018 05:23,great try sign put right stuff say im wrong would great got fixed,TRUE,,,,,,,,,,,,
37b0cede-eb53-43f8-8ee5-b0032ba7126b,Stopped working suddenly...Stuck in splash screen,1,18-10-2018 15:29,stopped working suddenlystuck splash screen,TRUE,,,,,,,,,,,,
a6365436-e1bc-4b7b-81df-f2e875fab489,It keeps telling me that there is something wrong with my payment method..-.- idk why!,3,25-11-2018 00:32,keep telling something wrong payment method idk,TRUE,,,,,,,,,,,,
a98354e9-94ef-4721-a618-f31a630be394,"Updating my review as the issue was in my phone. Works good. Want to try watching shows I downloaded 'for later', see if they work without data as promised.",5,25-11-2018 14:16,updating review issue phone work good want try watching show downloaded later see work without data promised,TRUE,,,,,,,,,,,,
4cacfa9a-7b49-4b2d-9bc2-bd43901c252e,"Your attempt to use WhatsApp as a means of contacting customers is a disaster. I can't get past the screen advertising this feature. As such the Netflix app is unusable now. Sort this out as a matter of urgency, please.",1,21-09-2018 00:35,attempt use whatsapp mean contacting customer disaster cant get past screen advertising feature netflix app unusable sort matter urgency please,TRUE,,,,,,,,,,,,
69561d77-0eb5-403a-8afe-25c3e2ce096c,really good for long car journeys and very fun to watch with your friends if your having a sleepover or want to watch a film with your family,5,25-12-2018 20:12,really good long car journey fun watch friend sleepover want watch film family,TRUE,,,,,,,,,,,,
79d9a42c-3b0c-4066-b674-a6f513ab5afc,Recent update completely broke casting which is ironic considering Netflix helped make the cast protocol. Shouldn't you guys do it better than anyone? It loses connection almost every time I try to watch something and it means I have to reconnect to watch the next episode. Also the cast button placement is terrible.,2,15-09-2018 06:53,recent update completely broke casting ironic considering netflix helped make cast protocol shouldnt guy better anyone loses connection almost every time try watch something mean reconnect watch next episode also cast button placement terrible,TRUE,,,,,,,,,,,,
1a593b9f-30ee-4f91-969e-ffb02ffbe1cd,"This app is great but only if it had the latest movies. Some are up to date but others aren't , so please work on that",5,30-11-2018 06:38,app great latest movie date others arent please work,TRUE,,,,,,,,,,,,
8a67a990-0d5a-4d7d-b31a-cb7e8773d5fb,Hijacks netflix links from browser by default. Absolutely unacceptable.,1,02-12-2018 17:44,hijack netflix link browser default absolutely unacceptable,TRUE,,,,,,,,,,,,
7d10f057-1e5d-45b3-b584-718ced33d296,i don't know the reason but Netflix don't work when i play movie at Chromecast. audio is coming with black screen,3,20-10-2018 07:25,dont know reason netflix dont work play movie chromecast audio coming black screen,TRUE,,,,,,,,,,,,
f925791d-1d96-4b5c-9b8d-bc3897532934,This won't get a good rating untill the app stops automatically turning on the subtitles everytime I watch something on my mobile devices. I NEVER use them to begin with. Also I hate not being able so scroll backwards on the ps4 anymore. Fix thses issues and it will be worth the better rating and money paid.,1,09-11-2018 17:45,wont get good rating untill app stop automatically turning subtitle everytime watch something mobile device never use begin also hate able scroll backwards p anymore fix th issue worth better rating money paid,TRUE,,,,,,,,,,,,
804adc9a-b4ea-47f4-b7ce-bf0d609b0919,I got the Ultra HD plan but there are only a couple of titles available in 4k. Tech support is useless.,1,24-11-2018 23:57,got ultra hd plan couple title available k tech support useless,TRUE,,,,,,,,,,,,
5ce80418-be92-4d90-aec7-570b5f620651,Its awsome app with NO ADDS!. If u want u want it ofline u can download the tv shows or movies so that u can watch it ofline,5,04-10-2018 09:52,awsome app add u want u want ofline u download tv show movie u watch ofline,TRUE,,,,,,,,,,,,
774c9e34-abdd-4fb4-b803-7a86a43bd04b,Amazing app to watch shows just need to add more shows on here. For example family guy.,5,05-11-2018 02:53,amazing app watch show need add show example family guy,TRUE,,,,,,,,,,,,
beb4f329-9ec8-4baf-a2aa-347a213d11a6,"App is not responding. If it does, it wont let you change your profile - all it does is load...",2,17-09-2018 10:52,app responding wont let change profile load,TRUE,,,,,,,,,,,,
9697b6ee-c3d8-4d71-bbe7-78372ca11a6f,I had no issues with the app. I was traveling and able to watch my movies,5,31-10-2018 19:02,issue app traveling able watch movie,TRUE,,,,,,,,,,,,
a2031b90-8524-484a-bb72-a89ea56ae54c,I love except now you have subtitles and it's SUPER DUPER ANNOYING I MEEN WHEN IM WATCHING MY SHOW IT HAS SUBTITLES AT THE TOP AND I CAN'T SEE THE PERSONS FACE😭😢😱😵😡😡😡😡😡😡😡😠😠😠😠😠😠😠,5,01-12-2018 22:08,love except subtitle superuper annoying meen im watching show subtitle top cant see theersons face,TRUE,,,,,,,,,,,,
6efd1f10-aeba-4abe-87a3-1f2a93632cda,Hi netfix creators i love your work and creativity thankyou for this amazing app but i am looking for the new hit movies and would like you to add hotel trancelvania 3 pls thanks .,5,25-09-2018 06:00,hi netfix creator love work creativity thankyou amazing app looking new hit movie would like add hotel trancelvania pls thanks,TRUE,,,,,,,,,,,,
bbf093c9-c31b-4ac0-9410-63746400f838,"I like Netflix I'm just really pissed that it keeps logging me out randomly very frequently, everytime I finish a episode it force logs me out... please fix!!!",3,23-09-2018 03:37,like netflix im really pissed keep logging randomly frequently everytime finish episode force log please fix,TRUE,,,,,,,,,,,,
3da0b1c0-be7c-4897-8a0f-808b74d57fbb,Love it! I even like it better than Hulu & any of the others! Netflix is by far my favorite so far.,5,17-12-2018 23:56,love even like better hulu others netflix far favorite far,TRUE,,,,,,,,,,,,
b9720faa-7425-40fb-841d-a6d1b3c81378,I enjoy Netflix and they own shows I just don't like that they nva really update they shows oftern it take over a yr to update and it's always a few episodes they put i end up forgetting about the app after a while and pretty much ready to take it down I'm paying just to wait,3,29-09-2018 01:10,enjoy netflix show dont like nva really update show oftern take yr update always episode put end forgetting app pretty much ready take im paying wait,TRUE,,,,,,,,,,,,
834bdfb0-3467-4b14-8763-201c082df2ae,Please allow some shows free with taking subctiptions please i don't hai movie enought to take subcriptions.,1,07-12-2018 16:24,please allow show free taking subctiptions please dont hai movie enought take subcriptions,TRUE,,,,,,,,,,,,
5af94f67-992b-498e-8f1b-03bc2e7f7c48,This is awesome. Especially if everyone is watching a program/movie I don't want to watch I will watch something on ths,5,22-10-2018 07:10,awesome especially everyone watching programmovie dont want watch watch something th,TRUE,,,,,,,,,,,,
998f21b9-eb85-4042-bf21-977a646b201c,"Its great, but they need to have a way to restart a show if you want rewatch it.",5,04-11-2018 17:50,great need way restart show want rewatch,TRUE,,,,,,,,,,,,
69a87e67-a535-4586-911c-50af20ae2f68,i love netflix but can you guys please add back all the bratz movies because i loved those and was really sad when they got removed,5,24-12-2018 19:58,love netflix guy please add back bratz movie loved really sad got removed,TRUE,,,,,,,,,,,,
83bd0258-fd4f-4ed7-b716-05e473fb12ab,i love this app however since the new update it stops every few minutes..it says it loading but my show never comes back on unless i exit out of it and go back in..,3,25-12-2018 03:57,love app however since new update stop every minutesit say loading show never come back unless exit go back,TRUE,,,,,,,,,,,,
90b7fdab-df54-4dd2-baa1-3b2825cd23ec,I think the app is great but id love it more if you had all of The Hunger Games in it only seen 1,5,16-10-2018 19:50,think app great id love hunger game seen,TRUE,,,,,,,,,,,,
b5217918-86c3-4886-8e54-e83ad36a6db3,Can Netflix please add back the bratz movies? Ive been looking forward to watching them when I first got netflix. If this happens I will rate 5 stars.,3,14-09-2018 00:50,netflix please add back bratz movie ive looking forward watching first got netflix happens rate star,TRUE,,,,,,,,,,,,
45c9714b-c64c-444f-95c5-9e7ab7b0bb3c,"Did have problems but all working fine, I use Netflix most nights as it gets me through long shifts working through the nights in an office so it's a godsend for me, if I was to be critical it would be about the selection of content on offer, I feel every country should have access to the same content, on a trip to Germany I went on Netflix and found many films I'd love to be able to watch but we don't get them in England which is a shame.",5,02-11-2018 17:47,problem working fine use netflix night get long shift working night office godsend critical would selection content offer feel every country access content trip germany went netflix found many film id love able watch dont get england shame,TRUE,,,,,,,,,,,,
05b95283-7c5f-4d25-8e80-2e12d6fe49a8,"Can't seem to be able to watch anything on phone because its say's that their not ready to watch instantly. What is the point to being able to have it at all times with you if you can't watch anything, very disappointing!!",1,29-12-2018 17:42,cant seem able watch anything phone say ready watch instantly point able time cant watch anything disappointing,TRUE,,,,,,,,,,,,
9bf40789-09a4-4967-b061-981d4b01e348,Hey my app suddenly started crashing nd shows that it does not support some of shows formats. It says system UI problem nd tells to close it. It was working perfectly earlier.Pls help me with this.,4,25-11-2018 01:35,hey app suddenly started crashing nd show support show format say system ui problem nd tell close working perfectly earlierpls help,TRUE,,,,,,,,,,,,
e2d519ff-baca-4ed1-b828-600dfce49a37,Inefficient 101.1.8 error on all downloaded titles requires re-download.,2,27-09-2018 18:31,inefficient error downloaded title requires redownload,TRUE,,,,,,,,,,,,
7f90a6ec-5412-4d13-bf21-2205eca9c9cb,I like this app very much but still ios version of this app is better because ut gives u option to watch trailer as well.android version does not give you watching trailer option.if u add it then it will be awesome.,5,24-09-2018 18:32,like app much still io version app better ut give u option watch trailer wellandroid version give watching trailer optionif u add awesome,TRUE,,,,,,,,,,,,
8b3a8124-d4f6-4fed-9fa8-4c40dd9abf8f,Considering a personal sentiment to creation I regard it rather an explicit selection and quite an intellectually interesting range of films to watch. Yes very exciting....,4,13-12-2018 07:15,considering personal sentiment creation regard rather explicit selection quite intellectually interesting range film watch yes exciting,TRUE,,,,,,,,,,,,
96f47c01-e255-4f46-a502-14dd12120e47,May i suggest a remote that let's you control Netflix if youre watching it from your plugged in computer on the TV. So I don't have to stand up and change what I'm watching. Like select what I want to watch from my phone then it plays on the computer. I'll give it that extra star.,4,11-11-2018 16:58,may suggest remote let control netflix youre watching plugged computer tv dont stand change im watching like select want watch phone play computer ill give extra star,TRUE,,,,,,,,,,,,
96c847e6-1b31-40e8-a12c-7be0a84893a9,"It's very good, I can watch shows that I like, and also catch up on",5,27-11-2018 22:01,good watch show like also catch,TRUE,,,,,,,,,,,,
d99d9c71-99a4-4980-b07b-a8fa8f5e054f,"I love Netflix, but why the heck did yall get rid of the genre menu. that was a stupid move!",3,30-12-2018 20:39,love netflix heck yall get rid genre menu stupid move,TRUE,,,,,,,,,,,,
e8f521fb-ab97-47f9-91be-061199233925,"it's great, but it sometimes will crash and will need to be updated frequently.",5,10-11-2018 04:48,great sometimes crash need updated frequently,TRUE,,,,,,,,,,,,
da8dc0c7-824d-4872-ba31-15a61fd8a30d,Netflix app on my android wont open. I try to install/uninstall several times.,4,22-10-2018 10:37,netflix app android wont open try installuninstall several time,TRUE,,,,,,,,,,,,
b49cf28b-5a47-40cb-9b40-4d0a5cb6a56f,If you have to update every 7 days not worth it. Plus can't get it to work at home. Had this problem for 3 years and still get lies from t-mobile,1,01-11-2018 00:54,update every day worth itlus cant get work home problem year still get lie tmobile,TRUE,,,,,,,,,,,,
8b7ae1b2-3387-4128-b996-e43ba085e9bb,"The App is good, but you need to bring back the 'Play Next Episode' button so we don't have to watch the credits. When looking for movies, there is no synopsis to describe what the movie is about. Not everyone wants to watch the trailer, just a description will do.",4,05-10-2018 03:59,app good need bring back thelay next episode button dont watch credit looking movie synopsis describe movie everyone want watch trailer description,TRUE,,,,,,,,,,,,
57c19715-80e0-4139-9f25-942c4eab4850,"I used to love Netflix, but lately there has been way to many movies that are not good. I just constantly scroll until I just give up. Nothing really eye catching to me. But whenever good movies do come on the streaming, I will watch. But, for right now, I have been watching other streaming services. But, I do love the baking shows.",3,01-11-2018 08:37,used love netflix lately way many movie good constantly scroll give nothing really eye catching whenever good movie come streaming watch right watching streaming service love baking show,TRUE,,,,,,,,,,,,
9c9be397-bbfc-4f97-bc3d-272f22f3efc6,It has good movies and all my favorite shows +Movies on it #loveit❤,5,12-10-2018 00:46,good movie favorite show movie loveit,TRUE,,,,,,,,,,,,
199004ba-267f-4475-ac5a-4bb4cdeaf004,"Overall a very good app, some TVseries do not have all seasons,",4,19-12-2018 03:58,overall good app tvseries season,TRUE,,,,,,,,,,,,
ac71b27a-999e-4176-b630-4d85d4b8dca2,Great but more months on free trail like 3 months,5,27-10-2018 19:40,great month free trail like month,TRUE,,,,,,,,,,,,
5a8667f7-5247-4106-80b6-d638f18c6679,It takes to longe to start my movies but other then that it's great.😀😁,5,01-12-2018 03:36,take longe start movie great,TRUE,,,,,,,,,,,,
b81a6213-c08b-45e9-981e-745d17941fd0,"Latest update drains my battery even when I don't use the app, great otherwise. I Uninstalled the app",3,29-11-2018 02:19,latest update drain battery even dont use app great otherwise uninstalled app,TRUE,,,,,,,,,,,,
a84fcacd-60ad-4a5b-b5d9-dea91650cba5,It works very well and I love all the movies and episodes,5,29-11-2018 20:53,work well love movie episode,TRUE,,,,,,,,,,,,
d7295042-d780-4240-a815-c77bf4a8d3d2,I love it...i can download movies over the internet and watch when im out of internet zone...great app on my phone,5,18-11-2018 11:54,love iti download movie internet watch im internet zonegreat app phone,TRUE,,,,,,,,,,,,
c73f7004-a420-45fa-bbf9-87635418b6cb,"It's a super awesome app to watch your tv shows and movies, but I wish they creators would add more movies and tv shows. But besides that you should totally use this app if you haven't already done so. 😊",5,17-09-2018 23:09,super awesome app watch tv show movie wish creator would add movie tv show besides totally use app havent already done,TRUE,,,,,,,,,,,,
c29c086f-baa3-4fc4-8ce5-102c4d3f01a4,Superb app. Netflix original webseries are superb..,5,27-09-2018 15:48,superb app netflix original webseries superb,TRUE,,,,,,,,,,,,
49d6ca8c-932b-4075-b8e9-1a29694d23bb,"With Netflix: there original show be free, the animes be good, and the love movies for that special person be popin as well. 5 out 5 straight up",5,28-09-2018 17:42,netflix original show free anime good love movie special person popin well straight,TRUE,,,,,,,,,,,,
