reviewId,comment,score,date,cleaned_text,english,bugs,content,feature,ui,navigation,billing,brand,price_billing_payment,login,device,customer support,other
e583f8a5-c050-476d-94bc-f2b146cf1663,"Netflix is installed on my phone by default, which I rarely and almost never use. I don't cast to my TV either, as my tv already has a Netflix app installed. Yet, whenever I watch Netflix on my tv, or even just browse Netflix on my computer, My phone battery is zapped by the Netflix app. When I say zap, I mean 50% gone and a new means to keeping my coffee warm. I will try simply logging out of Netflix on my phone followed by a forced stop to see how that goes. If the problem continues, it's bye bye Netflix on Android for me.",2,05-11-2018 16:46,netflix installed phone default rarely almost never use dont cast tv either tv already netflix app installed yet whenever watch netflix tv even browse netflix computer phone battery zapped netflix app say zap mean gone new mean keeping coffee warm try simply logging netflix phone followed forced stop see go problem continues bye bye netflix android,TRUE,,,,,,,,,,,,
2a74fa53-1e81-4d23-9fbb-c21d48f7e0b7,I love Netflix because I get to watch my favorite movies and series for example pretty little liars the flash and other movies,5,27-11-2018 01:27,love netflix get watch favorite movie series example pretty little liar flash movie,TRUE,,,,,,,,,,,,
8a8e928b-4a6d-48cc-bc86-9f572189ffb1,"I wish they didnt get rid of the tv shows i like,like jessie kickin it, LAB RATS! THAT WAS MY FAVORITE SHOW😡",4,07-11-2018 01:50,wish didnt get rid tv show likelike jessie kickin lab rat favorite show,TRUE,,,,,,,,,,,,
73f1dcbe-6009-42e9-818f-40271c69d43d,This app is awesome after Netflix switched their logo from white to black the netflix world took off anyone who abandoned it before should come back,5,15-12-2018 20:47,app awesome netflix switched logo white black netflix world took anyone abandoned come back,TRUE,,,,,,,,,,,,
93078e42-4b07-4cf1-9af9-c52a05d3b6df,101.1.8 always with this error. Such a drag downloading then having to delete them all again.,3,22-10-2018 13:25,always error drag downloading delete,TRUE,,,,,,,,,,,,
8f2dc61e-05cb-4add-a186-4711cccf245f,I wish it had a few movies like the good ol boys dukes of hazzard and a few other shows but it dont,3,30-12-2018 09:09,wish movie like good ol boy duke hazzard show dont,TRUE,,,,,,,,,,,,
c648dca8-6001-4bfe-8a65-56b72ff90ccd,I would like to have more options for the Turkish Netflix also it would be nice if new seasons and new movies came earlier..,5,07-12-2018 15:48,would like option turkish netflix also would nice new season new movie came earlier,TRUE,,,,,,,,,,,,
996c1696-4c3e-46f0-8db8-8c9b8cd01901,I keep trying to use the app and it won't load and I had it on my phone before and worked perfectly fine I keep uninstalling it and reinstalling and nothing is working.,1,22-09-2018 02:58,keep trying use app wont load phone worked perfectly fine keep uninstalling reinstalling nothing working,TRUE,,,,,,,,,,,,
ca281cd7-608f-48aa-b11a-22f093ae08e9,Doesn't allow access through a vpn. Even though i live in the u.s. and use u.s. based vpn with u.s. based server.,1,29-11-2018 03:32,doesnt allow access vpn even though live u use u based vpn u based server,TRUE,,,,,,,,,,,,
6295b096-5fad-4a88-8e47-3779dcbc3c5e,"Keeps signing me out every episode or more. Really annoying and distracts from the TV shows. Update: it does not sign me out anymore, but it does still glitch to where I cannot access my show unless I reset it.",4,01-12-2018 05:30,keep signing every episode really annoying distracts tv show update sign anymore still glitch access show unless reset,TRUE,,,,,,,,,,,,
308a5dfa-7b9f-41a6-944d-2b750ddefcd8,Only high rated subscription price other wise I loved the content on it,5,02-10-2018 09:28,high rated subscription price wise loved content,TRUE,,,,,,,,,,,,
3091b07e-828b-4cd9-8966-ce5e422666fa,"Can't even sign in, entered my details but keep getting brought back to the homepage with the sign in option",1,30-09-2018 21:47,cant even sign entered detail keep getting brought back homepage sign option,TRUE,,,,,,,,,,,,
69492c84-1d9e-45f8-8098-2ad1a016e6bd,"Nice app but monthly rental price very high .,",5,14-09-2018 18:58,nice app monthly rental price high,TRUE,,,,,,,,,,,,
a018ad0a-eb1e-4673-b4dc-fd703328e01b,"Netflix is Still The Reigning Champ of Streaming Services - Great Shows Old & New! eg.(My gens:) Star Trek Original Series (- being shown in the Upgraded Version, looks Not Far 'out of place' with the 1st Episodes of Star Trek Next Gen. Grand job so ! As Netflix is turning out to be ! Willing to take on New and/or Challenging Shows, Being Far-sighted enough to Commission it's Own, Shiny New Shows - One-off programs & Films, to Series' that will run for years. My only concern is Netflix being the author of its Own Demise by ""Amazon Priming"" itself ! Thinking the way to be out in front was to do it with Prices ? ∆ Amazon is a great company, No Doubt! Amazon will make a killing at Xmas, No Doubt ! But Amazon's Future as The TV. Based Leader of the Pack ? Or looking at it from My Own Personal Experience; No Offers to make Prime MY No.1 Entertainment Net, are going to make me Want to Pay £20/month ! Like a Lot of folks, I was using Amazon for Buying the ""whatever"" at the Cheapest Price inc. P&H I buy from Amazon UK. I live in Ireland. Being an Amazon Prime Member, is Not going to get me My Deliveries 1 Day earlier ! Amazon Prime doesn't get me Books any Quicker, just more Cheaply ! But Books I Want to Keep, are the Physical Work itself.I read my Grandchildren , Not Kindle - though I bought the First Version ! - Not on any Tablet, though the oldest boy has a Kids one ! No ! Books, where they can look At the pictures without wanting to hurry on ! Books, where they can watch My finger Under the Actual words I'm saying ! When I can stop on a word to ask if they know it, or what it means ! Books that they can have Instead of sweets.",5,02-12-2018 12:32,netflix still reigning champ streaming service great showsld new egmy gen star trekriginal series shown upgraded version look far place st episode star trek next gen grand job netflix turning willing take new andor challenging show farsighted enough commission itswn shiny new show neoff program film series run year concern netflix author itswnemise amazonriming thinking way front withrices ∆ amazon great company nooubt amazon make killing xmas nooubt amazon future tv based leader theack r looking mywnersonal experience noffers makerime entertainment net going make want toay £month like lot folk using amazon buying whatever cheapestrice inch buy amazon uk live ireland amazonrime member going get myeliveries ay earlier amazonrime doesnt get book quicker cheaply book want keep thehysical work itselfi read grandchild kindle though bought first version tablet though oldest boy kid one book look picture without wanting hurry book watch finger actual word im saying stop word ask know mean book instead sweet,TRUE,,,,,,,,,,,,
f0381a55-9249-42c1-800b-f86e11ba4358,The Netflix app is not opening since last three days trying to open but it doesn't open need help with that,2,18-10-2018 14:06,netflix app opening since last three day trying open doesnt open need help,TRUE,,,,,,,,,,,,
7e0e4049-eb76-42e0-a2b2-975c6f4655b3,Very lovely! I get to watch all of my favorite shows here in the UK that usually air not where I'm familiar with! Lovely I say!!,5,08-10-2018 12:45,lovely get watch favorite show uk usually air im familiar lovely say,TRUE,,,,,,,,,,,,
fef36a98-65fd-4c4c-aa7d-3dbe379f9cc9,"I don't have to give any comment for Netflix, Everyone knows how it is. Awesome for English TV series viewers. Still needs to work on Indian content. There are only few good Indian tv series.",5,28-09-2018 15:01,dont give comment netflix everyone know awesome english tv series viewer still need work indian content good indian tv series,TRUE,,,,,,,,,,,,
93cf53b9-9153-4253-805d-f5435ae834d6,"Not sure why, but you guys moved the cast icon to bottom right corner, right in front of other menu items, especially while casting where the cast icon os still there. Honestly can't believe how this got past your UX..",4,21-09-2018 18:09,sure guy moved cast icon bottom right corner right front menu item especially casting cast icon o still honestly cant believe got past ux,TRUE,,,,,,,,,,,,
cec07cfd-46f4-4451-b1f6-9c8540bf810b,This is a great app with a small fee to pay each month but if has all the films you could ask for,5,29-12-2018 19:44,great app small fee pay month film could ask,TRUE,,,,,,,,,,,,
9380c986-a49b-4ff4-9e65-0bf200ed8da5,Why they ask for money they must collaborate with jio and charge least money like 100 for basic 150 for premium and 200 for ultra HD enough of making us fooling digital marketing software.,1,24-10-2018 16:00,ask money must collaborate jio charge least money like basic premium ultra hd enough making u fooling digital marketing software,TRUE,,,,,,,,,,,,
1cb7b47f-77c8-4fbd-a9cd-b314d903ca03,It's great to download anything and watch it later when out of WiFi range. Use the app for my kids to use on the go.,5,19-10-2018 01:00,great download anything watch later wifi range use app kid use go,TRUE,,,,,,,,,,,,
d1c9fd3c-0653-4ba1-b7a4-55ae6de7b574,I like this app it works great even better then the Netflix on my tv,5,13-11-2018 18:56,like app work great even better netflix tv,TRUE,,,,,,,,,,,,
56604898-10c9-4844-9fd1-57221c63c4b8,I can't get updated versions on my seasons.. season 8 TWD,4,27-09-2018 01:08,cant get updated version season season twd,TRUE,,,,,,,,,,,,
e61043fd-9e6e-4e72-808d-f97f6d9c37d9,"This is not easy to use! my god i already signing up but when i click ""finish sign up"" it return to set up your payment. please help, im going to be a psycho on this up !!",5,28-11-2018 23:38,easy use god already signing click finish sign return set payment please help im going psycho,TRUE,,,,,,,,,,,,
acd69e93-5f44-4c05-9adc-805207f322ec,"The only issue i have is that i dont understand why with me being in Mexico, Netflix changes the type of movies and shows that they have. I was watching the Shameless series (U.S version) while being in U.S, then i come to Mexico and the U.S version is no longer available. It has also happened with other movies amd shows.",4,21-11-2018 00:56,issue dont understand mexico netflix change type movie show watching shameless seriesus version u come mexico u version longer available also happened movie amd show,TRUE,,,,,,,,,,,,
2154a5e6-d5a5-4f18-9c99-f0a1b380c21b,They hardly update movies so your watching the same sort of things and the personal profile of each user isn't that good,3,29-09-2018 12:45,hardly update movie watching sort thing personal profile user isnt good,TRUE,,,,,,,,,,,,
14d56064-ff76-492b-8fbc-d1a0fa647841,"I can't seem to stream Netflix on my Samsung note, the voice seems okay but I have a black monitor, I do not know why 🤷🏻‍♀️",2,22-11-2018 19:32,cant seem stream netflix samsung note voice seems okay black monitor know,TRUE,,,,,,,,,,,,
011dbc28-ad84-486a-813c-f21eea8b7109,"Nope. I uninstalled after I realized every time the app updated it would turn its notification settings back on, meaning I'd get spammed with netflix ads I purposely turned off. After the tenth update and tenth time I had to turn the notification setting off again, I uninstalled.",1,20-12-2018 19:15,nope uninstalled realized every time app updated would turn notification setting back meaning id get spammed netflix ad purposely turned tenth update tenth time turn notification setting uninstalled,TRUE,,,,,,,,,,,,
5fdf47ee-4e23-4aa4-b7c6-ae6b43c85186,need option to adjust streaming quality.. my wifi gets exhausted auto playing HD all the time.,1,23-12-2018 11:11,need option adjust streaming quality wifi get exhausted auto playing hd time,TRUE,,,,,,,,,,,,
5937acad-845f-4d9d-9cda-b91c8d1b961f,"It's good but its funny that it is a free app, but it cost money for the account",5,17-10-2018 05:55,good funny free app cost money account,TRUE,,,,,,,,,,,,
511e4ac4-2804-416a-8e9c-043695559f93,I think the app is brilliant but I would like every season of game of thrones on there would make it so much better,5,06-12-2018 22:43,think app brilliant would like every season game throne would make much better,TRUE,,,,,,,,,,,,
9fde335a-70d3-40da-83de-d023b907fba7,"But it's just waste of time and money. Subscription is little bit expensive. User must be allowed to switch video quality and speed, and may be play content through third party media players.",4,27-11-2018 16:05,waste time money subscription little bit expensive user must allowed switch video quality speed may play content third party medium player,TRUE,,,,,,,,,,,,
6af5d773-e774-470c-aa12-2c8593260423,"Great app for downloading and watching movies, shows, and anime :3",5,29-10-2018 01:46,great app downloading watching movie show anime,TRUE,,,,,,,,,,,,
d0414c3d-0317-4944-9651-be87a56da76e,"There were a few glitches, but I am not sure if that was from a past virus. There are a wide variety of movies for all ages. Over all it is pretty good.",4,16-12-2018 00:40,glitch sure past virus wide variety movie agesver pretty good,TRUE,,,,,,,,,,,,
76e03dc9-a787-4ac4-9a75-0077834cfebd,Previously the app would shut down and close by itself. Now it is not even working at all.,1,25-10-2018 20:19,previously app would shut close even working,TRUE,,,,,,,,,,,,
479a0520-f40c-4a45-a220-e1234461f147,"Revision to 3 stars; After a fix (no credit to Netflix on that score) I managed to get my app working again. However despite not being able to download the episodes I wanted to, it tells me I'm over the limit for downloads. Failed downloads shouldn't count towards totals. 3 stars for current functionality, loses points for customer accessibility and poor management of account usage (downloads) Original review; App ruined. Used to be great, but latest update lost all my downloaded episodes. Now can't download anything. Can still stream if I'm lucky but can't watch offline anymore. Always thought this was 5 stars, but lately has to be 1 until issue fixed.",1,10-10-2018 17:24,revision star fixno credit netflix score managed get app working however despite able download episode wanted tell im limit downloads failed downloads shouldnt count towards total star current functionality loses point customer accessibility poor management account usagedownloadsriginal review app ruined used great latest update lost downloaded episode cant download anything still stream im lucky cant watch offline anymore always thought star lately issue fixed,TRUE,,,,,,,,,,,,
18765a68-2b93-49db-b11a-5f8227aa283d,Great app. Only getting better. Could do with more movie choices and classics,5,14-11-2018 09:34,great appnly getting better could movie choice classic,TRUE,,,,,,,,,,,,
9bc9adb9-2cde-4e4a-b173-72f1157edb35,"when I bought this phone I was told I got 30 FREE days, I watched one movie the day I brought the phone home and haven't been able to get Netflix since.",1,25-12-2018 03:41,bought phone told got free day watched one movie day brought phone home havent able get netflix since,TRUE,,,,,,,,,,,,
b8da462a-921d-4092-a894-92c81c1d2872,"I love netflix, i think it is a really good app for watching your favorite movies and tv shows.",4,12-10-2018 20:24,love netflix think really good app watching favorite movie tv show,TRUE,,,,,,,,,,,,
d92811fe-fd62-4b7e-a447-39c48247d111,There should be a forward by 10 seconds option too.,4,17-11-2018 19:36,forward second option,TRUE,,,,,,,,,,,,
52cc3266-8dd2-42d3-b858-1c56b880952d,Failed to open on my Samsung S8 following an update. #fail!,1,24-09-2018 09:28,failed open samsung following update fail,TRUE,,,,,,,,,,,,
de5c0bdc-5f9f-41fc-af2f-20e3b994ed26,I love Netflix I even like how you can download movies to show you can watch them in the car with out data or WiFi,5,22-11-2018 16:30,love netflix even like download movie show watch car data wifi,TRUE,,,,,,,,,,,,
b82467bf-628a-404f-b35d-78bcb13a46ef,Really great. The interface and organisation of e every thing in the app is amazing.,5,19-10-2018 19:56,really great interface organisation e every thing app amazing,TRUE,,,,,,,,,,,,
56f20985-3d4f-4a6c-be25-d9e35fde33bb,"Oh it's the best streaming app. The UI is Great and every feature is awesome. So smooth and flawless experience. But still Rs500 per month is a little bit higher if I couldn't get shows like Game of Thrones, New Amsterdam, The Good Doctor, 911, and many more.",5,06-12-2018 02:23,oh best streaming app ui great every feature awesome smooth flawless experience still r per month little bit higher couldnt get show like game throne new amsterdam goodoctor many,TRUE,,,,,,,,,,,,
25dd03f7-c77a-4912-a1c8-e8730afca9ad,I downloaded the app but when i try to access it... I can't open it.i subscribe already. I want to cancel my subscription.,1,20-10-2018 21:12,downloaded app try access cant open iti subscribe already want cancel subscription,TRUE,,,,,,,,,,,,
eed659f6-d016-472d-a4fd-1715c75b0999,Not working on my Samsung Galaxy S8 plus and always sign me out whenever I try to skip some minutes from any videos.,2,31-10-2018 01:40,working samsung galaxy plus always sign whenever try skip minute video,TRUE,,,,,,,,,,,,
51b90b5b-46f1-4960-9938-cc8daf8a6a25,"I like Netflix very much, I use it on a browser almost everyday. When I get away from my house I download some episodes to watch on the go (That's why I use this app). The app is pretty bad. I encountered problem everytime I use it, problem that I never had on a web browser. Sometime the app doesn't even remember which episode I was listening last.",2,24-12-2018 21:00,like netflix much use browser almost everyday get away house download episode watch gothats use app app pretty bad encountered problem everytime use problem never web browser sometime app doesnt even remember episode listening last,TRUE,,,,,,,,,,,,
d6b63814-d302-4c52-ab6f-2380aa52c6da,You need to fix this it won't updateand I've uninstalled it and tried to reinstall it and it won't work please fix,3,11-12-2018 22:52,need fix wont updateand ive uninstalled tried reinstall wont work please fix,TRUE,,,,,,,,,,,,
5286d3fe-dab0-401c-aff3-04092afd9078,I couldn't connect in the application I called the help desk and they told me to uninstall the application Andre sign in.,1,10-10-2018 16:20,couldnt connect application called help desk told uninstall application andre sign,TRUE,,,,,,,,,,,,
9fe577ca-0114-4b01-9c6b-ca9b9d863816,Disney+ is the game changer.. But i Love Netflix,5,15-11-2018 05:22,disney game changer love netflix,TRUE,,,,,,,,,,,,
89535da7-d8df-4fb3-9dea-5a7d8d4b8fa1,App is nice and lots of entertainment But one thing is not good that is resume play back and forward button,5,15-12-2018 23:50,app nice lot entertainment one thing good resume play back forward button,TRUE,,,,,,,,,,,,
55c9970f-102e-4407-b910-8430650df330,Not perfect with stuff coming and going but to be fair guess that's what happens when you have so much on your channel which really is kind of bullcrap really it shouldn't cost so much money when you have stuff on your Channel if anything it should be the exact opposite.,3,08-12-2018 22:09,perfect stuff coming going fair guess thats happens much channel really kind bullcrap really shouldnt cost much money stuff channel anything exact opposite,TRUE,,,,,,,,,,,,
d96356cb-9305-480e-9f40-c363cbb0082a,Wait... They did just cancel two superhero shows I want to see more of... Maybe five stars is a bit- *Remembers Daredevil season 3.* Nope. Dex is worth it.,5,30-10-2018 10:15,wait cancel two superhero show want see maybe five star bitremembersaredevil season nopeex worth,TRUE,,,,,,,,,,,,
53473a1c-13d4-4958-9753-5d3dcf252d94,"It's a great app, there are just a few frustrating things. Being able to go back to the previous screen using the back button in the app and the back button on my phone is an issue sometimes, especially when I'm trying to find other shows/movies using the ""more like this"" tab. Having to go all the way back to the starting point is really frustrating because I'm not always able to remember the title of the show that I'm trying to go back and look at. I've missed out on tons of potential shows because of such a small issue.",3,11-12-2018 13:32,great app frustrating thing able go back previous screen using back button app back button phone issue sometimes especially im trying find showsmovies using like tab go way back starting point really frustrating im always able remember title show im trying go back look ive missed ton potential show small issue,TRUE,,,,,,,,,,,,
1a4201dd-b2b2-4ab9-9925-f734a9aab700,"Even when the app is restricted to run using wifi only, it still runs spontaneously while data is on. App turns on randomly and drains phone battery.",1,30-11-2018 16:57,even app restricted run using wifi still run spontaneously data app turn randomly drain phone battery,TRUE,,,,,,,,,,,,
5100b945-8bab-41b2-ae75-612fe8e82ae3,"With OnePlus 6 running on Oxygen OS 9, can't run videos on Fullscreen mode. The app does not feature in the ""App display in fullscreen"" section in Settings, hence making it impossible to change the settings.",2,24-10-2018 17:53,withneplus running onxygens cant run video fullscreen mode app feature app display fullscreen section setting hence making impossible change setting,TRUE,,,,,,,,,,,,
12d640c2-7624-4b08-93c5-ed4ef143838d,"the apps always make my huawei mate 20pro phone restarts, probably has some bugs",4,05-12-2018 10:50,apps always make huawei mate pro phone restarts probably bug,TRUE,,,,,,,,,,,,
4a691a4c-e658-44c8-ac96-eed01bf2e25b,"Just needs description of each show or movie. I hate having to look up what each show or movie is about. Then maybe a better way to display newly added movies or shows. Alito of the time, its stuff added months ago.",4,29-09-2018 12:17,need description show movie hate look show movie maybe better way display newly added movie show alito time stuff added month ago,TRUE,,,,,,,,,,,,
2e701ba6-231b-4e7b-ac51-d1be89d0c8cb,I love Netflix I need it to watch movies or shows.,5,23-11-2018 23:16,love netflix need watch movie show,TRUE,,,,,,,,,,,,
a6cd4947-d9a7-44da-b232-34e47d724a51,"About 10 minutes into any show it starts to freeze the video, but audio and subtitles still work. Reset my device numerous times and factory reset it still does it. Galaxy Tab S3. Worked until last update now unusable. Netflix works through windows 10 in my house but not on my tablet. Resume also doesnt work.",2,18-11-2018 18:37,minute show start freeze video audio subtitle still work reset device numerous time factory reset still galaxy tab worked last update unusable netflix work window house tablet resume also doesnt work,TRUE,,,,,,,,,,,,
d768ace8-2c83-40f4-9422-92f8c2d1458c,"It's 🐌 an needs to be faster at all times,and not freezing all the time",5,31-10-2018 17:37,need faster timesand freezing time,TRUE,,,,,,,,,,,,
fcfea8e5-0705-4d6e-899e-346e966a856e,Nice to Quality and bethout buffering Streaming running continue,5,13-11-2018 17:37,nice quality bethout buffering streaming running continue,TRUE,,,,,,,,,,,,
8282d558-2e42-490c-a2be-03c5982588fa,"Netflix is kinda good cuz you can see all movies and series and all but it kinda sucks when you have to sign up and all and I freaking hate it when it says ""sorry, something went wrong"" like what when wrong bro?",3,14-12-2018 03:35,netflix kinda good cuz see movie series kinda suck sign freaking hate say sorry something went wrong like wrong bro,TRUE,,,,,,,,,,,,
e71c43cd-3510-4179-a50c-e283541832ca,It's one of the best application to view online movies and series can carry in your pocket and make best out of it,5,24-11-2018 00:54,one best application view online movie series carry pocket make best,TRUE,,,,,,,,,,,,
7e2f6586-3ce9-41f9-be7c-95ffa8b3e823,"Battery drains fast, phone heats up.",2,11-11-2018 11:52,battery drain fast phone heat,TRUE,,,,,,,,,,,,
c8aa06da-39b0-450a-8000-b3729baab05d,"they shouldn't reccomend things. No, wait they should make a line (like popular on netflix and the other things) that just has every movie on netflix in it and a line that has every series in it. Like that maybe we could watch movies and series we havent heared of or get some new interests in series",4,23-09-2018 12:23,shouldnt reccomend thing wait make linelike popular netflix thing every movie netflix line every series like maybe could watch movie series havent heared get new interest series,TRUE,,,,,,,,,,,,
e6118fa9-c85e-4433-bc2c-3c0a026d88fd,I wanted to pay for this but it does not accept our card system. Dear Netflix team when you are providing facilities In our country India then why don't you accept other payment options of card... Please work upon it.. Accept Rupay debit card,2,10-11-2018 13:42,wanted pay accept card systemear netflix team providing facility country india dont accept payment option cardlease work upon accept rupay debit card,TRUE,,,,,,,,,,,,
8ef8dd04-eaf6-4602-9b1c-f822d95ce00a,I can't log in and watch movie because the server always busy. Please fix it. Thankyou,1,21-11-2018 14:04,cant log watch movie server always busylease fix thankyou,TRUE,,,,,,,,,,,,
540ba9bf-8d06-4183-aee0-300445ccae5e,Great content but could still add more of mainstream movies and series. The originals are on par. Looking forward for more.,4,21-11-2018 17:49,great content could still add mainstream movie series original par looking forward,TRUE,,,,,,,,,,,,
