reviewId,comment,score,date,cleaned_text,english,bugs,content,feature,ui,navigation,billing,brand,price_billing_payment,login,device,customer support,other
9136165c-c2e0-4703-a0e2-8b0390ea1bae,Can't change default audio. Always disconnects with Chromecast,2,11-10-2018 05:07,cant change default audio always disconnect chromecast,TRUE,,,,,,,,,,,,
dbea8af8-e098-41f9-b94e-70af842a96e2,"pretty good app overall, if it was better about having movies with sequels all on i d give it 5 s but it usually doesn't have all the entire sequel s to certain movies",4,12-12-2018 14:30,pretty good app overall better movie sequel give usually doesnt entire sequel certain movie,TRUE,,,,,,,,,,,,
3b919d73-1404-4ee0-af5a-f78442b1c4d7,"No offense, but theres too much in the way of foriegn languages, not necessarily a bad thing... but there seems to be more than in my native tongue.... give an option and also when I've seen a movie I dont want it to always show up in trending just because you've changed the icon doesn't mean I want to watch it again.... put it under a seen folder?",3,14-11-2018 09:56,offense there much way foriegn language necessarily bad thing seems native tongue give option also ive seen movie dont want always show trending youve changed icon doesnt mean want watch put seen folder,TRUE,,,,,,,,,,,,
cb034e2e-84bb-4bc3-9496-6e2efe2e450a,"Please fix the bug that restricts viewing rotation, it's stuck in portrait orientation as per some below complaints. There were no issues previously so I can't see why it would appear after an update",2,30-10-2018 17:17,please fix bug restricts viewing rotation stuck portrait orientation per complaint issue previously cant see would appear update,TRUE,,,,,,,,,,,,
851fc07f-55b5-4335-aff6-25e1a9bd964f,Since the update I have not been able to turn it so I can watch it landscape on my phone. Its tiny on portrait view.,3,30-10-2018 10:27,since update able turn watch landscape phone tiny portrait view,TRUE,,,,,,,,,,,,
5bdbffcf-5273-428a-b1e1-efd155ed8b55,"I love the app. everything about it. it gives me all the features I expect. a suggestion for the app overall though; we need an option to pick ""not interested"" when browsing through series & movies. especially under the ""top picks for...""",5,14-10-2018 03:18,love app everything give feature expect suggestion app overall though need option pick interested browsing series movie especially top pick,TRUE,,,,,,,,,,,,
a938737d-d005-4d37-9498-3ed566c9f8c1,I want to see the friends serial.. I want the episodes here.. It always gets uploaded but removed within a day.. Please show that serial. It's amazing.,4,07-10-2018 06:19,want see friend serial want episode always get uploaded removed within daylease show serial amazing,TRUE,,,,,,,,,,,,
4676993d-8804-4dbc-a5bd-6db7bda043e9,I wish the star rating system came back. I hate the thumps up/down system.,4,30-11-2018 21:33,wish star rating system came back hate thump updown system,TRUE,,,,,,,,,,,,
57239b62-b30c-4e49-8338-f154c06bf513,Was a great app and service but now that Netflix has announced a greedy almost 30% price increase it will soon be like all the others.,2,29-11-2018 23:14,great app service netflix announced greedy almost price increase soon like others,TRUE,,,,,,,,,,,,
4a0751b2-09a9-4704-b352-c7d728de48f9,Great just needs more titles in search engine,5,26-10-2018 04:58,great need title search engine,TRUE,,,,,,,,,,,,
e3225d32-b454-4df6-8792-13c4b165d326,If you would lower the price just like 50 % more this would be the most used app in all platforms,5,26-09-2018 15:24,would lower price like would used app platform,TRUE,,,,,,,,,,,,
b6797112-2f76-459d-af65-56c6588a9045,If they would make all English dub videos inside of optional not interested in subtitle movies.,4,11-11-2018 10:39,would make english dub video inside optional interested subtitle movie,TRUE,,,,,,,,,,,,
7e643323-2573-48dc-ac44-ca649a8454c4,Wont let me pause or rewind doesn't go into landscape mode and refuses to be use a a streaming service,1,30-10-2018 19:29,wont let pause rewind doesnt go landscape mode refuse use streaming service,TRUE,,,,,,,,,,,,
21bb868a-8b00-48bf-b599-c0dbf935409a,Changed our password and hunting for where to update it on the app. Otherwise awesome!,4,19-12-2018 01:10,changed password hunting update apptherwise awesome,TRUE,,,,,,,,,,,,
6af43d09-4d6f-4713-991f-0ba364e3bc64,Netflix is a great app to use to stream many varieties of movies and series. It's awesome considering it's very cheap and easy accessibility,5,03-12-2018 21:35,netflix great app use stream many variety movie series awesome considering cheap easy accessibility,TRUE,,,,,,,,,,,,
29eaf656-1e75-407e-b5d9-60c4ac7e706c,"This is an incredible app,but i have to admit it needs more movies and tv series i would love to see a lot more",4,13-12-2018 16:40,incredible appbut admit need movie tv series would love see lot,TRUE,,,,,,,,,,,,
c1b6bbba-8544-4b26-8b5e-3e2c885f21cc,I wish that this would work with Samsung Dex. It won't play in full screen.,3,26-10-2018 04:01,wish would work samsungex wont play full screen,TRUE,,,,,,,,,,,,
c2c43a3d-0763-48bf-b61b-398e2f30a371,"Thank you for nothing, with the new update I can't even see my list of favourited anymore. It just shows me promotions for new thing in Home and nothing else.",1,06-10-2018 19:05,thank nothing new update cant even see list favourited anymore show promotion new thing home nothing else,TRUE,,,,,,,,,,,,
1d0e683c-3cea-46e7-8568-eeb916e39151,It is amazing keep up the good work Netflix is the best,5,07-11-2018 14:40,amazing keep good work netflix best,TRUE,,,,,,,,,,,,
04375765-481c-47d8-a06f-c7b22c0fbee7,Awesome! Has most of my favorite TV shows I can binge on. Fantastic assortment of movies. Love Netflix!,5,06-12-2018 18:47,awesome favorite tv show binge fantastic assortment movie love netflix,TRUE,,,,,,,,,,,,
78e451e6-9390-4086-895b-e0aa6e10b5bc,Great app! Good playback quality. Offline downloads play extremly smoothly! Overall 5/5.,5,05-10-2018 19:06,great app good playback qualityffline downloads play extremly smoothlyverall,TRUE,,,,,,,,,,,,
5d1a05bc-9fe4-405a-a18f-5e3c875cac49,"F is for family Season 3 was suppose to come out on November 30th and it says watch now, but 2 days later.. Its still not on there. Some people have had access to it while others are still waiting..",3,01-12-2018 20:17,f family season suppose come november th say watch day later still people access others still waiting,TRUE,,,,,,,,,,,,
18ebf20e-efc6-411b-9b66-02f9ae7a0517,New update always starts volume very loud when streaming to Chrome cast.,3,20-09-2018 19:11,new update always start volume loud streaming chrome cast,TRUE,,,,,,,,,,,,
185b1ff3-ce39-4873-8653-1576bf82176a,"This latest update introduced a bug that forces me to sign out and back in every time the app is launched in order to make the cast button reappear, and since I really only use the app to cast to my Chromecast it's a serious annoyance.",1,01-11-2018 14:46,latest update introduced bug force sign back every time app launched order make cast button reappear since really use app cast chromecast serious annoyance,TRUE,,,,,,,,,,,,
90dccb23-24f1-439f-bea7-2c9ddd6ca3e2,I hi know what the best thing to go about in this is to make the game a little bit more difficult and difficult as the players will get a chance of a good start,5,10-11-2018 08:26,hi know best thing go make game little bit difficult difficult player get chance good start,TRUE,,,,,,,,,,,,
2b209c62-4d17-418b-8764-6fafd28a7ba7,It should be some more tv shows.. like Good times or Tyler Perry plays or movies,3,04-10-2018 00:47,tv show like good time tylererry play movie,TRUE,,,,,,,,,,,,
d430be0a-e2ac-4b82-b242-b52171027f66,"Like it overall, but wish Netflix's story & quality standards weren't slacking as their prices rise.",4,16-12-2018 14:45,like overall wish netflixs story quality standard werent slacking price rise,TRUE,,,,,,,,,,,,
c20ffee1-cc1a-42cb-bb9e-b8fc1585cb8c,"The app is fine but it's have some issues with casting. The ""next episode"" button is covered with other menu, it's looks like a ui bug.",3,16-09-2018 07:08,app fine issue casting next episode button covered menu look like ui bug,TRUE,,,,,,,,,,,,
7bc26c86-078a-40b8-9c89-6193932adb98,"I think Netflix is awesome it gives more movies, TV programs and options than any other",5,08-11-2018 11:37,think netflix awesome give movie tv program option,TRUE,,,,,,,,,,,,
cbdd42f1-909e-46e7-bb15-7dfba19aa23d,"After I finish watching something it still shows up at continue watching for ""..."" I would like to get rid of it",4,08-10-2018 04:33,finish watching something still show continue watching would like get rid,TRUE,,,,,,,,,,,,
1039ef1a-b1e2-44df-942a-4544d7e4d4ef,"On Huawei Mate 10 Pro, the HDR picture quality is insane! As a shareholder they pay my bills. At night I get entertained! What's not to love!? All jokes aside, the app is more modern than Prime Video. What really sets Netflix apart is the original content. Simply amazing and will only continue to dominate as they spread to other parts of the world!",5,13-12-2018 23:57,huawei mate ro hdr picture quality insane shareholder pay bill night get entertained whats love joke aside app modern thanrime video really set netflix apart original content simply amazing continue dominate spread part world,TRUE,,,,,,,,,,,,
d8ed1472-f64e-4685-be7e-314fa7e2c01e,Netflix is great because I can download shows and watch them on the bus ride home from school or to school without using data,5,16-09-2018 04:35,netflix great download show watch bus ride home school school without using data,TRUE,,,,,,,,,,,,
71344c31-8a8c-42ee-9db1-dd39b4d819d2,"Somehow overheats my Samsung s8, noticeable phone getting warmer when watching movies",3,07-12-2018 20:51,somehow overheats samsung noticeable phone getting warmer watching movie,TRUE,,,,,,,,,,,,
d7125e22-8695-42b9-bd71-b2e3f8455c2d,Worst version of Netflix ever! Has a lot of buffering issues even on WiFi! Sometimes nothing even plays! Not worth the money or time on Android!,1,24-11-2018 20:36,worst version netflix ever lot buffering issue even wifi sometimes nothing even play worth money time android,TRUE,,,,,,,,,,,,
6da852b7-a266-4a7e-b6b1-12a7b5d9f1a2,I really liked the customer support. The call was answered shortly and I got the refund immediately for the miscommunication. :),5,01-10-2018 03:52,really liked customer support call answered shortly got refund immediately miscommunication,TRUE,,,,,,,,,,,,
c4303e3d-3917-46b9-a057-e7a986b91482,Great entertainment! Lots of Canadian movies that we never get here that are really good!,5,22-11-2018 15:29,great entertainment lot canadian movie never get really good,TRUE,,,,,,,,,,,,
d76213ce-184f-4da4-87fc-8d75cf24bf2a,All of a sudden the app has stopped working... Can u fix it,3,14-11-2018 05:16,sudden app stopped working u fix,TRUE,,,,,,,,,,,,
97e58858-f8b0-4de6-a699-516c912ff177,It's good..just want u to add all hp series and disney shows,5,01-11-2018 10:49,goodjust want u add hp series disney show,TRUE,,,,,,,,,,,,
d1fe0f87-a1ae-47a6-9bc5-5e396ee3eda6,Who doesn't love Netflix like come on lol...... Really love it but need to have more new movies but beside all that i really enjoy it.💕💕,5,09-11-2018 03:14,doesnt love netflix like come lol really love need new movie beside really enjoy,TRUE,,,,,,,,,,,,
6d3fe9f1-eec2-427a-8123-f1357ac35292,"I love netflix!! I can watch all my favourite shows, like brooklyn nine-nine",5,18-10-2018 22:16,love netflix watch favourite show like brooklyn ninenine,TRUE,,,,,,,,,,,,
adae954f-8616-4128-adf6-cf91f23dc582,"The number of glitches OMG. I would get a phone call and when i would go back to the Netflix show i am watching, it would close and not open. I have to sign out and sign in again. So inconvenient",1,25-11-2018 01:00,number glitchesmg would get phone call would go back netflix show watching would close open sign sign inconvenient,TRUE,,,,,,,,,,,,
503541d0-5017-475c-9549-d3d15cd5fe7f,"Not prefer to give credit or debit card details in free trial month. If we like, can pay but after trial period.",1,07-10-2018 03:00,prefer give credit debit card detail free trial month like pay trial period,TRUE,,,,,,,,,,,,
d87fb75d-c9a4-44b8-a0ea-fcaeba06ffbf,The app is not compatible with my tablet so I have to except unknown sources so I can use the app. I don't think that's right,2,26-09-2018 20:57,app compatible tablet except unknown source use app dont think thats right,TRUE,,,,,,,,,,,,
01cd5016-a3ca-4902-894e-376b51e7b926,But you r version is not compatible with our android box. So we don't enjoy Netflix on big screen,3,18-11-2018 18:09,r version compatible android box dont enjoy netflix big screen,TRUE,,,,,,,,,,,,
663871f9-3947-48fc-9067-f8db2f178691,No ability to control streaming quality on mobile is B.S. would be nice not to have my data burned through in a day.,1,12-12-2018 00:34,ability control streaming quality mobile b would nice data burned day,TRUE,,,,,,,,,,,,
d29e3c03-90fb-4306-8cb2-fcd976f82ad9,I've just started watching Netflix lately and i love it! I love all of their originals. They have good content for everyone.,5,18-09-2018 13:32,ive started watching netflix lately love love original good content everyone,TRUE,,,,,,,,,,,,
d5753f30-50bb-4b97-a253-46f1b7e17892,Cannot cast on Chromecast Builtin TV. Disappointed. Rest all. the apps support but this app. displays the cast icon but when I click on cast icon it says could not connect to target device. Living Room TV (160004) Please help,1,13-12-2018 17:58,cast chromecast builtin tvisappointed rest apps support app display cast icon click cast icon say could connect target device living room tvlease help,TRUE,,,,,,,,,,,,
1ebbb444-7623-4429-96ff-07a8d989f329,good but it won't let me make a decision when I try to watch bandersnatch so I haven't gotten even 30 minutes in because I dont wanna be stuck with the same ending,4,29-12-2018 22:48,good wont let make decision try watch bandersnatch havent gotten even minute dont wan na stuck ending,TRUE,,,,,,,,,,,,
a1ee9636-3cb5-419b-b074-a41ead74315c,"I have a question,I saw on tv that Airtel users get free 3 months. True?",5,14-11-2018 08:51,questioni saw tv airtel user get free month true,TRUE,,,,,,,,,,,,
00ca3f45-3326-4578-b5df-4cc65ffb2262,"Seems like 90% of the shows on netflix now are foreign. Some of them are really good, only issue is I hear english but I don't see it......it makes it very difficult to watch anything when you keep noticing that slight error. Obviously these films were intended to be like that. But with the already limited shows on netflix why pay even more for less...",1,17-12-2018 02:50,seems like show netflix foreign really good issue hear english dont see itit make difficult watch anything keep noticing slight errorbviously film intended like already limited show netflix pay even le,TRUE,,,,,,,,,,,,
6bf1c773-56f9-4a9b-935d-a8649b76dfc5,Tried to join and was unable. Tried to see plans and was unable tp see them,1,01-10-2018 23:45,tried join unable tried see plan unable tp see,TRUE,,,,,,,,,,,,
7e7f9188-c956-4395-bb77-ccea4ccfad2e,"""There is a problem playing the video. Please try again. (5.8)"" every time I try to watch a video",3,14-12-2018 23:16,problem playing videolease try every time try watch video,TRUE,,,,,,,,,,,,
ff8855bd-a475-42f3-895e-a10b2af4adaf,"Ever since it updated on my android if I try to fast forward, the app stops and completely logs me out. It's so annoying to have to log in every single time I fast forward through something. Also glitches out if something happens fast pace like a chase scene or something and then cant load and stops/signs me out again. Hate it. Fix this please.",1,26-09-2018 23:12,ever since updated android try fast forward app stop completely log annoying log every single time fast forward something also glitch something happens fast pace like chase scene something cant load stopssigns hate fix please,TRUE,,,,,,,,,,,,
3e9faf34-f104-4d79-87be-f314d5a63a09,This app is so lit I can always watch movies and shows that i missed on cable. Read more...,3,20-10-2018 12:48,app lit always watch movie show missed cable read,TRUE,,,,,,,,,,,,
a32b0d19-2fec-4e55-8de4-ed1d6ec24b86,"Love it but be more frequent with adding new episodes TV shows and series,like 2mins ago I finished Naruto there's 220 episodes but on Netflix there's 156 so...Ya",5,21-10-2018 20:37,love frequent adding new episode tv show serieslike min ago finished naruto there episode netflix there soya,TRUE,,,,,,,,,,,,
b90fd5c9-3b9e-4ad2-a2c3-bd22bc6e15df,I like some of the new things yall add but I hate that yall take off old TV shows that alot of people watch and see dont get to finish them before they are gone.,3,20-11-2018 02:38,like new thing yall add hate yall take old tv show alot people watch see dont get finish gone,TRUE,,,,,,,,,,,,
a5dcf7d8-1096-4438-8e55-5d26fc933d9f,I like that Netflix has the shows I want to watch.,5,15-11-2018 05:37,like netflix show want watch,TRUE,,,,,,,,,,,,
c68a41bf-af6b-4ad1-a4ee-1ccf0478f2d0,Iam not satisfied as much I expected. Iam a trail period user.. and feel like.. it's not getting updated regularly and it holds a couple of movies only... Like.. mostly celebrated movies... Only... We have another options for those kind of movies... But as a film hunter i always prefer much better movies so... I prefer that kind of a platform,5,11-10-2018 15:52,iam satisfied much expected iam trail period user feel like getting updated regularly hold couple movie like mostly celebrated moviesnly another option kind movie film hunter always prefer much better movie prefer kind platform,TRUE,,,,,,,,,,,,
a45115eb-6661-432c-b765-cb6a44434d44,Updated netflix on the ps3 and now have a lag problem and pauses that was not there before the update please fix. Has been good up till last update.,1,09-10-2018 04:16,updated netflix p lag problem pause update please fix good till last update,TRUE,,,,,,,,,,,,
c3b09de5-aa32-43ed-a1ba-33b4de22cc6a,good app but very less popular movies....almost every movie i wanted to see was not there... youtube paid movies are better..,3,25-12-2018 06:57,good app le popular moviesalmost every movie wanted see youtube paid movie better,TRUE,,,,,,,,,,,,
1a75d816-1075-4711-8d15-82bfea1979b7,I LOVE Netflix because you can choose to watch ANYTHING availiable on it and cable doesn't have that.,5,09-11-2018 07:26,love netflix choose watch anything availiable cable doesnt,TRUE,,,,,,,,,,,,
7d2a78a3-abbb-4602-9c56-0ae5b012b492,"I can't open it, it always says that the can't connect to server or couldn't reach the server. Is there something happen with mine?",1,07-12-2018 13:07,cant open always say cant connect server couldnt reach server something happen mine,TRUE,,,,,,,,,,,,
5966421f-0411-47be-83b9-601027121831,Full screen is not working in notch mobiles as youtube does,4,18-11-2018 07:28,full screen working notch mobile youtube,TRUE,,,,,,,,,,,,
3e82849d-9df3-446b-97df-b751bca68463,All cool but can I request for an additional feature where the app provides the info about the music/songs been playing in the background. Would be of great use.,5,30-12-2018 06:23,cool request additional feature app provides info musicsongs playing background would great use,TRUE,,,,,,,,,,,,
05b58398-15fa-4548-a869-73a65134c5a1,I love the App because you can watch free movies and TV shows,5,01-11-2018 09:25,love app watch free movie tv show,TRUE,,,,,,,,,,,,
5e2b07ff-b779-4efa-9217-a2a85adc3679,Helps me watch the best TV shows and not much ads,5,15-10-2018 02:46,help watch best tv show much ad,TRUE,,,,,,,,,,,,
4ac52c69-55af-46f3-8b50-a1cf3531235a,"Love it! New addiction!! But currently this past few weeks my Netflix keeps crashing, I need to install and uninstall back.. Any idea why??",5,21-10-2018 12:48,love new addiction currently past week netflix keep crashing need install uninstall back idea,TRUE,,,,,,,,,,,,
d1708f65-a2f1-4f4d-bd9c-393f5a98cdfe,I love this app but I just downloaded onto my tablet and it's not letting me get into the app. It won't even let me get into the sign up part.,5,23-10-2018 00:53,love app downloaded onto tablet letting get app wont even let get sign part,TRUE,,,,,,,,,,,,
663a8721-7974-4e8a-a4cb-5bc308346909,Netflix is awesome but but it keeps talking off my fav TV shows,5,08-12-2018 15:58,netflix awesome keep talking fav tv show,TRUE,,,,,,,,,,,,
ed0e799f-5ea8-4133-b962-e813887e5894,I have had Netflix for a long time. we really enjoy watching the movie with the grandkids.,5,11-10-2018 15:49,netflix long time really enjoy watching movie grandkids,TRUE,,,,,,,,,,,,
74d18894-d84c-4bb6-8153-efa1086c7dc1,Needs improvements and a notification for when theirs a update needed that would conclude my issues with it overall good job.,4,29-11-2018 19:53,need improvement notification update needed would conclude issue overall good job,TRUE,,,,,,,,,,,,
85fd1411-567d-4c4d-939f-3809f90b0599,"Great movies, download and watch anywhere, very convenient. Even the stuff made Netflix is great. I highly recommend.😉😉",5,14-12-2018 06:45,great movie download watch anywhere convenient even stuff made netflix great highly recommend,TRUE,,,,,,,,,,,,
81c581b6-adf8-4fbf-98d2-c0647d63eacf,I have had Netflix for 15 years now and I'm grateful they were able to create an app that is suitable and awesome. Love it!,5,02-10-2018 02:35,netflix year im grateful able create app suitable awesome love,TRUE,,,,,,,,,,,,
d7d11ec4-8a7a-411f-9682-7209338f88cd,Not bad with hulu you got TV covered. Lots to watch.,5,03-12-2018 21:11,bad hulu got tv covered lot watch,TRUE,,,,,,,,,,,,
c3643063-453d-4dd4-8a18-1f9107c812a5,Needs more movies and needs to work better with low wifi speed networks It needs a much wider variety of movies the movies avaliable is boring,2,02-12-2018 12:00,need movie need work better low wifi speed network need much wider variety movie movie avaliable boring,TRUE,,,,,,,,,,,,
3dea3f13-271e-45f1-bd13-afce2caf6a18,I think it should have newer shows and bring back older shows that if had in the past,5,22-10-2018 03:04,think newer show bring back older show past,TRUE,,,,,,,,,,,,
ba348749-60bb-48c3-ab2e-8e8cc1fad263,it is a good way to watch movies as you do not have to go online you just have to log in and you can watch any movie or tv series,5,28-12-2018 11:05,good way watch movie go online log watch movie tv series,TRUE,,,,,,,,,,,,
ce9c207b-e900-465c-b66c-c9d2bf143c5e,"Since the last update or two, the app continues to run in the background eating up my battery. Even after I 'force stop' it in my settings. This is after I've made sure the app was closed after using it. Other than that, its a good app. But the amount of battery this uses makes it unbearable to have on my phone.",2,03-10-2018 16:00,since last update two app continues run background eating battery even force stop setting ive made sure app closed using itther good app amount battery us make unbearable phone,TRUE,,,,,,,,,,,,
2486d717-c9c5-489d-a4f9-29d97c9624c5,App keeps sucking up phone battery even though it was never opened. This has happened on three different devices for me.,1,24-11-2018 20:00,app keep sucking phone battery even though never opened happened three different device,TRUE,,,,,,,,,,,,
ce26cc73-71b8-49cb-acce-afde48ec489f,"It keeps saying it has a device error on my Asus Chromebook when there is nothing wrong with my device, also you have a very limited mvie selection as well as having some titles people have never heard of you often put movies sequals on without having the first one on their as well It would be nice to see some popular and more current titles like NOW TV has",2,28-12-2018 21:25,keep saying device error asus chromebook nothing wrong device also limited mvie selection well title people never heard often put movie sequals without first one well would nice see popular current title like tv,TRUE,,,,,,,,,,,,
e59f1937-a30a-40e1-8377-a06ecf78f94f,"Used to like netflix when they first came out and was not biased. However, it now caters way to much to liberals. And the Obama network?.?.?. Uh.... no. Goodbye Netflix. Hire some none bias representitives. And a new slogan for you. ""Make netflix great again."" By the way I am neither Republican nor democrat. Stop brain washing the people.",1,23-10-2018 03:03,used like netflix first came biased however caters way much liberal thebama network uh goodbye netflix hire none bias representitives new slogan make netflix great way neither republican democrat stop brain washing people,TRUE,,,,,,,,,,,,
aca99961-3f30-4953-978f-7ac287a18b42,Issue with black screen - videos will not play,1,02-10-2018 20:43,issue black screen video play,TRUE,,,,,,,,,,,,
a79fa1c0-3c55-40fa-8cee-26f275ee531f,Never an issue! Brilliant originals ans vast variety. Cheers! Keep up the fantastic work!,5,25-09-2018 03:32,never issue brilliant original an vast variety cheer keep fantastic work,TRUE,,,,,,,,,,,,
e0bb2ea9-f695-41f1-a9b4-304506af7c64,"Please don't add any more cringy TV shows it ruins the whole platform. Because of Auto play it shows you the show while you're seacrhing for a show/movie. So please, I know you make from the company that wanted the show on there but you made this for people, not money.",4,15-12-2018 07:40,please dont add cringy tv show ruin whole platform auto play show show youre seacrhing showmovie please know make company wanted show made people money,TRUE,,,,,,,,,,,,
04ae53d6-3ae0-4dbb-a50e-a398d9492d9c,Netflix is great only there is not many good shows any more,5,02-12-2018 03:17,netflix great many good show,TRUE,,,,,,,,,,,,
